{
  "schema_version": 1,
  "operation": {
    "state": "definition",
    "stage": "boot_readiness",
    "id": "nautobot-boot-readiness-v1",
    "target": "j2-svpi4mf",
    "authorization_ready": true,
    "source_commit": "4f58125f784bc6a0a9ffd17761f202073f00ee57"
  },
  "plan_sha256": "7c88ea81725930b1a7c410d0f34d944b2882b195641e10b213a69409a74e838c",
  "root": "/var/lib/nautobot/boot-readiness.45bc4a738b684c6da22617bb962d6d32",
  "baseline": {
    "collected_at": "2026-09-25T17:48:33.780722+00:00",
    "boot_id": "70c9f650-a6a2-4583-84a9-f96462bef393",
    "artifact_sha256": {
      "/var/lib/nautobot/runtime/initialize-application.py": "4f7126411510e7d7a5d0abb940b4cca0f62ed0476b237700573e13974c0ca78b",
      "/var/lib/nautobot/.config/containers/systemd/nautobot-migration.container": "72826833864565b7398148b7e6636622bc4bef2fe1734d691b04343bf95e5a72",
      "/var/lib/nautobot/.config/containers/systemd/nautobot-nautobot_media.volume": "ce6a04a71f24fd4c17ad4e39c366e67af2a0affa4c96272d297a3fde36d65e13",
      "/var/lib/nautobot/.config/containers/systemd/nautobot-postgresql.container": "a2e12b77cf54ac7fc8d9cb7d1699db9b8188d422bbf1aa894ea9497023876684",
      "/var/lib/nautobot/.config/containers/systemd/nautobot-postgresql_data.volume": "0d570e4cc759483781ac5c4fa2162591d3a60c2978e0be7bfcdb6996ffbe3e7a",
      "/var/lib/nautobot/.config/containers/systemd/nautobot-private.network": "0bbf16ca337942502efffc0adb6a8694671c16ee143ee83b7b6009cb753fbc63",
      "/var/lib/nautobot/.config/containers/systemd/nautobot-redis.container": "e07c7c3e89adb7a5c57efa32639cbdea28fc11d04be340a2eabfce0d6faa9aae",
      "/var/lib/nautobot/.config/containers/systemd/nautobot-redis_data.volume": "b2a22985771b52cac95550657feea845252072a82ec3844f48bcda25666dd717",
      "/var/lib/nautobot/.config/containers/systemd/nautobot-scheduler.container": "7dde40f84c637dd79ec5859cf9a17ec9e68b2e111d647a39a8987e7c7cb248db",
      "/var/lib/nautobot/.config/containers/systemd/nautobot-web.container": "c8adc29062e82fdf5d524eb339b312b66611e81085d06235df658e5cce5a2e76",
      "/var/lib/nautobot/.config/containers/systemd/nautobot-worker.container": "d01b0ed26ea2b9228c3b126aac6d9e4329faec41eb0ac644245d6f4c9e9d989d",
      "/var/lib/nautobot/runtime/startup-application.py": "70f74c788a9dd10ea1e440aa94d15c5c75befe63bf79c263bfe1d8f6949f76fb",
      "/var/lib/nautobot/runtime/startup-command.py": "701061362ce1fc9b24c36fa8cc2d78eb9c100f5e8a13d9f63c6034d76ccea606",
      "/var/lib/nautobot/runtime/startup-job-probe.py": "07d35ced450e972c08e55a9bc195573e9e1b440db5fb3f676947748e6105042c",
      "/var/lib/nautobot/runtime/startup-job.py": "85e9ad36f04975a7c72426d92d31c91a36c0b5045d2c6010eef91b1a61c029e6"
    },
    "services": {
      "postgresql": {
        "InvocationID": "ee3b1e849adb4309a209dfc6068681ac",
        "NRestarts": "0"
      },
      "redis": {
        "InvocationID": "8ac68489850f4518b7452f84e4cebc28",
        "NRestarts": "0"
      },
      "web": {
        "InvocationID": "30f8615ad1dc40aaadf422ffffb85fb9",
        "NRestarts": "0"
      },
      "worker": {
        "InvocationID": "d15bd077a5024e26bac40440338a2bd5",
        "NRestarts": "0"
      },
      "scheduler": {
        "InvocationID": "f4526fa135694288820cb5748740088c",
        "NRestarts": "0"
      }
    },
    "sessions": {
      "1": {
        "Id": "1",
        "User": "999",
        "Service": "systemd-user",
        "Class": "manager-early",
        "Leader": "812",
        "State": "active"
      }
    }
  },
  "artifacts": [
    {
      "name": "startup-application.py",
      "destination": "/var/lib/nautobot/runtime/startup-application.py",
      "before_sha256": "70f74c788a9dd10ea1e440aa94d15c5c75befe63bf79c263bfe1d8f6949f76fb",
      "after_sha256": "59ec7f31b177187ac3c653e99ca8087e32578a0cab3b633dee39d48a09a0021e"
    },
    {
      "name": "nautobot-migration.container",
      "destination": "/var/lib/nautobot/.config/containers/systemd/nautobot-migration.container",
      "before_sha256": "72826833864565b7398148b7e6636622bc4bef2fe1734d691b04343bf95e5a72",
      "after_sha256": "2b1b6a4c363baf95f84370f80694eb3d232a99fa6bc416933e62405ac40ecca2"
    }
  ],
  "boundaries": {
    "restart": false,
    "reboot": false,
    "database_write": false,
    "backup_or_restore": false
  }
}
